Title,Severity,URL
(BYPASS) Open redirect and XSS in supporthiring.shopify.com,,https://hackerone.com/reports/158434
CSRF in github integration,Medium,https://hackerone.com/reports/174328
[community.informatica.com] - CSRF in Private Messages allows to move user's messages to Trash,High,https://hackerone.com/reports/45050
Possible CSRF during external programs,Low,https://hackerone.com/reports/174470
Cross-Site Request Forgery (CSRF),,https://hackerone.com/reports/157993
Twitter Disconnect CSRF,,https://hackerone.com/reports/114127
Payment gateway status transferred to Shopify without authentication,,https://hackerone.com/reports/56628
Changing paymentProfileUuid when booking a trip allows free rides,,https://hackerone.com/reports/162809
CSRF To change Email Notification Settings ,,https://hackerone.com/reports/157956
CSRF,,https://hackerone.com/reports/65167
WooCommerce: Support Ticket indirect object reference,,https://hackerone.com/reports/91599
CSRF  Add Album On  onpatient.com ,,https://hackerone.com/reports/99647
Add tweet to collection CSRF ,,https://hackerone.com/reports/100820
CSRF - Add optional two factor mobile number,,https://hackerone.com/reports/155774
CSRF Full Account Takeover,,https://hackerone.com/reports/152052
Security Issue : CSRF Token Design Flaw,,https://hackerone.com/reports/141065
CSRF on Vimeo via cross site flashing leading to info disclosure and private videos go public,,https://hackerone.com/reports/136481
[CSRF] Install premium themes ,,https://hackerone.com/reports/103351
Possible CSRF during joining report as participant ,,https://hackerone.com/reports/148517
Multiple Cross Site Request Forgery Vulnerabilities in Concrete5 version 5.7.3.1,,https://hackerone.com/reports/59660
CSRF in login form would led to account takeover,,https://hackerone.com/reports/50703
[CRITICAL]  CSRF  leading to account take over ,,https://hackerone.com/reports/141344
Missing Server Side Validation of CSRF Middleware Token in Change Password Request,,https://hackerone.com/reports/120143
SVG parser loads external resources on image upload,,https://hackerone.com/reports/97501
Akismet Several CSRF vulnerabilities,,https://hackerone.com/reports/131108
UniFi v3.2.10 Cross-Site Request Forgeries / Referer-Check Bypass,,https://hackerone.com/reports/52635
[HIGH RISK] CSRF could potentially delete a zendesk subdomain.,,https://hackerone.com/reports/132049
ProBlog 2.6.6 CSRF Exploit,,https://hackerone.com/reports/133847
No Limitation on Following allows user to follow people automatically!,,https://hackerone.com/reports/43846
CSRF on eng.uber.com may lead to server-side compromise,,https://hackerone.com/reports/125594
Websites opened from reports can change url of report page,,https://hackerone.com/reports/124889
[CRITICAL] Full account takeover using CSRF,,https://hackerone.com/reports/127703
Отвязываем Twitter от любого профиля вк ! + несколько багов по дизайну,,https://hackerone.com/reports/71337
[CRITICAL] CSRF leading to account take over,,https://hackerone.com/reports/102194
Обход защиты от csrf-ок в m.ok.ru,,https://hackerone.com/reports/102376
CSRF AT SELECTING ZAMATO HANDLE,,https://hackerone.com/reports/113857
Account Takeover,,https://hackerone.com/reports/121827
owncloud.com: Account Compromise Through CSRF,,https://hackerone.com/reports/84372
apps.owncloud.com: CSRF change privacy settings,,https://hackerone.com/reports/85565
CSRF in apps.owncloud.com,,https://hackerone.com/reports/84395
Login CSRF using Google OAuth,,https://hackerone.com/reports/118737
Internal GET SSRF via CSRF with Press This scan feature,,https://hackerone.com/reports/110801
CSRF in Connecting Pinterest Account,,https://hackerone.com/reports/104931
Twitter Disconnect CSRF,,https://hackerone.com/reports/111216
Attach Pinterest account - no State/CSRF parameter in Oauth Call back,,https://hackerone.com/reports/111218
CSRF possible when SOP Bypass/UXSS is available ,,https://hackerone.com/reports/103787
URGENT : NICHE.co Account Take Over Vulnerability,,https://hackerone.com/reports/100849
Csrf near report abuse meme ,,https://hackerone.com/reports/93154
Missing of csrf protection ,,https://hackerone.com/reports/96470
 [CSRF] Activate PayPal Express Checkout,,https://hackerone.com/reports/99321
Limited CSRF bypass.,,https://hackerone.com/reports/99708
rails-ujs will send CSRF tokens to other origins,,https://hackerone.com/reports/49935
Multiple so called  'type juggling' attacks. Most notably PhabricatorUser::validateCSRFToken() is 'bypassable' in certain cases.,,https://hackerone.com/reports/86022
owncloud.com: Allowed an attacker to force a user to change profile details. (XCSRF),,https://hackerone.com/reports/83239
"No csrf protection on index.php/ccm/system/user/add_group, index.php/ccm/system/user/remove_group",,https://hackerone.com/reports/64184
The product/status method CSRF,,https://hackerone.com/reports/74595
authenticity_token is not random across page loads,,https://hackerone.com/reports/71006
Logout any user of same team,,https://hackerone.com/reports/54610
[mobile.twitter.com / twitter.com] CSRF protection bypass,,https://hackerone.com/reports/14883
[URGENT ISSUE] Add or Delete the videos in watch later list of any user .,,https://hackerone.com/reports/52982
Marking notifications as read CSRF bug,,https://hackerone.com/reports/5946
iOS App can establish Facetime calls without user's permission,,https://hackerone.com/reports/28500
"CSP Bypass: Click handler for links with data-method=""post"" can cause authenticity_token to be sent off domain",,https://hackerone.com/reports/47472
Make API calls on behalf of another user (CSRF protection bypass),,https://hackerone.com/reports/44146
Leaking CSRF token over HTTP resulting in CSRF protection bypass,,https://hackerone.com/reports/15412
HTML form without CSRF protection at http://try.crashlytics.com/enterprise/,,https://hackerone.com/reports/25128
Unvalidated Channel names causes IRC Command Injection,,https://hackerone.com/reports/29480
Clickjacking & CSRF attack can be done at https://app.mavenlink.com/login,,https://hackerone.com/reports/14494
Resubmitted with POC #18685 Password reset CSRF,,https://hackerone.com/reports/18698
CSRF   in crashlytics.com,,https://hackerone.com/reports/13856
CSRF to Account Take Over Bug ,,https://hackerone.com/reports/7116
Login CSRF,,https://hackerone.com/reports/21069
CSRF vulnerability on https://sehacure.slack.com/account/settings,,https://hackerone.com/reports/2628
"CSRF on ""Set as primary"" option on the accounts page",,https://hackerone.com/reports/10563
logout csrf app.simplenote.com/logout,,https://hackerone.com/reports/13705
NO CSRF token found on user details update,,https://hackerone.com/reports/15454
Login CSRF using Twitter oauth,,https://hackerone.com/reports/13555
 User Account Creation CSRF ,,https://hackerone.com/reports/7051
Session Token is not Verified while changing Account Setting's which Result In account Takeover,,https://hackerone.com/reports/15476
Log Out Cross site Request Forgery,,https://hackerone.com/reports/7516
Login CSRF in Secret.ly,,https://hackerone.com/reports/7936
"CSRF in function ""Set as primary"" on  accounts page",,https://hackerone.com/reports/10829
Sign  up CSRF,,https://hackerone.com/reports/13583
Projects Watch or Notifications Settings Change Via CSRF,,https://hackerone.com/reports/8273
Login CSRF can be bypassed (Similar approach to previous one).,,https://hackerone.com/reports/7531
Change user settings through CSRF,,https://hackerone.com/reports/7870
Simplenote Silverlight cross-domain policy misconfiguration,,https://hackerone.com/reports/7571
CSRF - Creating accounts,,https://hackerone.com/reports/7332
HTML Form without CSRF protection,,https://hackerone.com/reports/6888
Sign up CSRF,,https://hackerone.com/reports/6872
Session Token is not Verified while changing Account Setting's which Result In account Takeover,,https://hackerone.com/reports/6907
Login CSRF,,https://hackerone.com/reports/6871
Private Project Access Request Invitation Sent Via CSRF ,,https://hackerone.com/reports/8226
 Private Project Access Request Accpeted Via CSRF ,,https://hackerone.com/reports/8224
Group Creation Via CSRF,,https://hackerone.com/reports/8216
Group Deletion Via CSRF,,https://hackerone.com/reports/8218
A password reset page does not properly validate the authenticity token at the server side.,,https://hackerone.com/reports/742
CSRF in adding phrase.,,https://hackerone.com/reports/7962
No Cross-Site Request Forgery protection at multiple locations,,https://hackerone.com/reports/7916
Sign-up Form CSRF,,https://hackerone.com/reports/7865
XSS & HTML injection,,https://hackerone.com/reports/7876
Full account takeover using CSRF and password reset,,https://hackerone.com/reports/6910
CSRF on add comment section,,https://hackerone.com/reports/2638
flash content type sniff vulnerability in api.slack.com,,https://hackerone.com/reports/3455
csrf,,https://hackerone.com/reports/2635
State parameter missing on google OAuth,,https://hackerone.com/reports/2688
Login CSRF using Twitter OAuth,,https://hackerone.com/reports/2228
Log in a user to another account,,https://hackerone.com/reports/774
Switching the user to the attacker's account,,https://hackerone.com/reports/727
Information disclosure (reset password token) and changing the user's password,,https://hackerone.com/reports/738
CSRF login,,https://hackerone.com/reports/547
